{
  "schemaVersion": "1",
  "grantId": "33333333-3333-4333-8333-333333333333",
  "deviceId": "11111111-1111-4111-8111-111111111111",
  "installationId": "22222222-2222-4222-8222-222222222222",
  "devicePublicKeyFingerprint": "sha256:aaaaaaaaaaaaaaaaaaaaaaaaaaaaaaaaaaaaaaaaaaaaaaaaaaaaaaaaaaaaaaaa",
  "plan": "pro_home",
  "features": [
    "autark-pro.extension"
  ],
  "releaseChannel": "staging",
  "issuer": "autark-pro-staging",
  "issuedAt": "2026-07-19T12:00:00Z",
  "updatesThrough": "2029-07-19T12:00:00Z",
  "localUse": "perpetual",
  "keyId": "staging-entitlement-2026-01"
}
